filename: hard-disks-bad-block-howto_20140102.txt
http://linuxaria.com/pills/hard-disks-bad-block-howto?lang=en#more-7833

[28]Hard Disks: Bad Block HowTo

    [29]Pills  [30]Add comments
   Dec 312013

   IFRAME:
   [31]http://www.linksalpha.com/social?blog=Linuxaria&link=http%3A%2F%2Flinuxaria.com%2Fpills
   %2Fhard-disks-bad-block-howto%3Flang%3Den&title=Hard+Disks%3A+Bad+Block+HowTo&desc=Today+I+
   present+an+interesting+aritcle+on+Bad+Blocks%2C+first+published+on+http%3A%2F%2Fvirtualpriv
   ateserver.castlegem.co.uk%2F+Hardware+fails%2C+that+is+a+fact.+Nowadays%2C+hard+drives+are+
   rather+reliable%2C+but+nevertheless+every+now+and+then+we+will+see+drives+failing+or+at+lea
   st+having+hiccups.+Using&fc=333333&fs=arial&fblname=like&fblref=facebook&fbllang=en_US&fbls
   how=1&fbsbutton=1&fbsctr=1&fbslang=en&fbsendbutton=1&twbutton=1&twlang=en&twmention=linuxar
   ia&twrelated1=linuxaria&twrelated2=&twctr=1&lnkdshow=show&lnkdctr=1&buzzbutton=1&buzzlang=e
   n&buzzctr=1&diggbutton=1&diggctr=1&stblbutton=1&stblctr=1&g1button=1&g1ctr=1&g1lang=en-US

   Today I present an interesting aritcle on Bad Blocks, first published on
   [32]http://virtualprivateserver.castlegem.co.uk/

   Hardware fails, that is a fact. Nowadays, hard drives are rather reliable, but nevertheless
   every now and then we will see drives failing or at least having hiccups. Using
   smartcl/smartd to monitor disks is a good thing, below we will discuss how some lesser
   issues can be handled without actually having to reboot the system – it is still up to a
   sys admin’s own discretion to judge circumstances correctly and evaluate whether disk
   errors encountered are a one time incident or indicative of an entirely failing disk.

   Let’s have a look at a typical smartcl -a DEVICE output:

   # smartctl -a /dev/sda
...
ID# ATTRIBUTE_NAME          .... RAW_VALUE
197 Current_Pending_Sector  .... 2
...

   OK, so we have an oops here. Time to find out what is going on:

   # smartctl –test=short /dev/sda

   This will take a very short time, a couple of minutes at most, e.g.:
Please wait 2 minutes for test to complete.
Test will complete after Sat Feb  2 16:25:10 2013

   Now, with a current pending sector count > 0 we will most likely have an ouch after the
   test completes:
Num  ..  Status                  Remaining  ..  LBA_of_first_error
...
# 2  ..  Completed: read failure 90%        ..  1825221261
...

   LBA counts sectors in units of 512 bytes and starts at 0, so we now need to find out where
   1825221261 is actually located:

   # fdisk -lu /dev/sda

   will display some information about the device in question:
   Device Boot      Start         End      Blocks   Id  System
...
/dev/sda3        31641600  1953523711   960941056   83  Linux
...

   Obviously, 1825221261 is on /dev/sda3, thus. Now we need to determine the file system block
   for our LBA in question, so we first have to get the block size:

   # tune2fs -l /dev/sda3 | grep Block
Block count:              240235264
Block size:               4096
Blocks per group:         32768

   OK, 4096 bytes. So, the actual block number will be:

   (LBA – PARTITION_START_SECTOR) * (512 / BLOCKSIZE)

   In our case, this is:

   (1825221261 – 31641600) * (512 / 4096) = 224197457.625

   We only need the integer part, the fraction just tells us that we are into the 6th sector
   out of eight that make up this file system block.

   It is good practice to find out which inode/file has been affected by using debugfs
   (operations can take a while with this tool):

   # debugfs
debugfs:  open /dev/sda3
debugfs:  icheck BLOCK (224197457 in our case)
Block   Inode number
224197457       56025154
debugfs:  ncheck 56025154
Inode   Pathname
56025154        /some/path/to/file

   Now, if this file isn’t anything crucial, then we can start correcting things now:

   # dd if=/dev/zero of=/dev/sda3 bs=4096 count=1 seek=BLOCK
   (224197457 here)
   # sync

   smartctl -a will now show an updated current pending sector count, and you can re-run a
   short smartctl test.

